{
  "schemaId": "cd-collab.experiment_package.v1",
  "packageId": "pkg-synth-strategy-paths-v1",
  "privacyClass": "share_safe",
  "taskFingerprint": "task-162aec8ca84e72ecfc9164d4168d18b6e41367e7c10e9c23aef086bf83bfd007",
  "snapshotFingerprint": "snap-5a75de4d710765b3fbb87afdc85beb25fd96f23b46ef4c59d416aa7ae61bbceb",
  "candidates": [
    {
      "candidateId": "cand-programmatic-agent",
      "modelLabel": "programmatic-agent",
      "role": "single",
      "runStatus": "completed",
      "observedLatency": { "status": "observed", "milliseconds": 1800 },
      "cost": { "status": "unknown" },
      "usage": { "status": "unknown" },
      "helpfulnessState": "unreviewed",
      "goldState": "unknown"
    },
    {
      "candidateId": "cand-chat-operator",
      "modelLabel": "chat-operator",
      "role": "single",
      "runStatus": "completed",
      "observedLatency": { "status": "unknown" },
      "cost": { "status": "unknown" },
      "usage": { "status": "unknown" },
      "helpfulnessState": "unreviewed",
      "goldState": "unknown"
    }
  ],
  "agreement": {
    "sharedAnchors": [
      {
        "evidenceRef": "ev-demo-checkout-log",
        "role": "symptom",
        "candidateIds": ["cand-programmatic-agent", "cand-chat-operator"]
      },
      {
        "evidenceRef": "ev-demo-inventory-timeout",
        "role": "cause",
        "candidateIds": ["cand-programmatic-agent", "cand-chat-operator"]
      }
    ],
    "candidateSpecific": [],
    "roleConflicts": [],
    "notes": [
      "Agreement is not proof of correctness.",
      "Synthetic two-approach checkout fixture. Not live provider output."
    ]
  }
}
